{
  "$schema": "schema.json",
  "ip2as": "../ip2as/test.csv",
  "as2org": {
    "as2org": "../retrieve-external/orgs/20181001.as-org2info.txt.gz"
  },
  "as-rels": {
    "rels": "../retrieve-external/rels/20180801.as-rel.txt.bz2",
    "cone": "../retrieve-external/rels/20180801.ppdc-ases.txt.bz2"
  },
  "warts": {
    "files": "warts.files"
  },
  "processes": 3
}